{"contentOpportunity":{"title":"Actualizar title/meta y reforzar diferenciación de material en la página de taquillas fenólicas para la variante local \"en Palencia\"","summary":"La keyword \"taquillas fenólicas en palencia\" es una variante geolocalizada de una página ya existente que puede captar demanda local de compra si el title/meta se ajusta y el contenido deja claro por qué la fenólica es la opción frente a melamina/metálica, evitando canibalizar el cluster ya existente."},"targetAudience":"Responsable de compras o mantenimiento de un colegio, gimnasio, piscina municipal o polideportivo en Palencia y su provincia que necesita renovar taquillas en zonas húmedas (duchas, vestuarios) y busca proveedor cercano o que sirva en su zona.","searchIntent":"transactional","commercialIntent":"Captar leads B2B locales listos para pedir presupuesto de taquillas fenólicas, aprovechando que la búsqueda combina material concreto + ubicación (señal de intención de compra cercana a la decisión), sin prometer cobertura logística que no está confirmada en el input.","angle":"Diferenciar explícitamente la fenólica frente a melamina y metálica (resistencia a humedad e impacto, uso en piscinas/duchas/gimnasios) para que la página no compita por las mismas señales que el cluster de melamina/colegios ya detectado, y anclar el contenido en casos de uso B2B reales de la zona sin inventar presencia o plazos locales.","contentType":"title_meta_improvement","targetBrand":"zentry","recommendedStructure":{"h1":"Taquillas Fenólicas en Palencia: Resistencia y Durabilidad para Espacios Húmedos","sections":[{"heading":"Taquillas fenólicas: características y usos","level":"H2","purpose":"Presentar el material fenólico (resistencia a humedad e impacto, acabado técnico) usando el catálogo confirmado de la marca, y sus entornos típicos (piscinas, duchas, gimnasios, polideportivos) para que el lector confirme que es el material adecuado a su caso."},{"heading":"Fenólica vs. melamina vs. metálica: cómo elegir","level":"H2","purpose":"Diferenciar claramente esta página del cluster de taquillas de melamina/colegios ya detectado, ayudando a decidir según humedad del entorno y nivel de uso, para reducir el riesgo de canibalización interna."},{"heading":"Taquillas fenólicas para colegios, gimnasios y piscinas en Palencia","level":"H2","purpose":"Conectar la keyword geolocalizada con casos de uso B2B concretos de la zona, sin afirmar cobertura de servicio, plazos de entrega o presencia local que no vienen confirmados en el input."},{"heading":"Solicita tu presupuesto de taquillas fenólicas","level":"H2","purpose":"Bloque de conversión que remite a presupuesto a medida sin fijar precios ni condiciones no confirmadas."},{"heading":"Preguntas frecuentes sobre taquillas fenólicas","level":"H2","purpose":"Resolver dudas habituales (medidas, mantenimiento, diferencias con otros materiales) para capturar featured snippets, sin introducir cifras de garantía o plazo no confirmadas."}]},"ctaStrategy":{"primaryCta":"Solicitar presupuesto sin compromiso","rationale":"Coincide con recommendedCtaHint y encaja con la intención transactional de la keyword (material + ubicación); al no tener datos de precio, plazo o cobertura local confirmados, el CTA remite a presupuesto a medida en vez de prometer cifras."},"internalLinks":[{"anchorIdea":"taquillas de melamina","targetDescription":"página/categoría de taquillas de melamina, keyword relacionada: taquillas melamina, taquillas de melamina","isRealLink":false},{"anchorIdea":"taquillas para colegios","targetDescription":"página de categoría de taquillas escolares/colegios, keyword relacionada: taquillas colegios, taquillas escolares","isRealLink":false},{"anchorIdea":"ver todo el catálogo de taquillas","targetDescription":"landing o categoría principal de taquillas, según internalLinkHints (\"landing/categoría principal relacionada\")","isRealLink":false}],"supportingEvidence":["currentAssumptions confirma que la keyword y la página https://zentrylockers.com/taquillas-fenolicas/ siguen vigentes y existiendo en esa URL.","clusterNote advierte de posible cluster/canibalización con taquillas melamina, taquillas de melamina, taquillas colegios, taquillas escolares y comprar taquillas, lo que justifica el ángulo de diferenciación de material en vez de repetir contenido genérico de esas páginas.","brandRationale del contexto confirma intención principal de compra de mobiliario (Zentry) y material detectado fenólica/fenólicas, coherente con el catálogo confirmado de materiales de la skill de marca."],"priority":"medium","risksAndUnknowns":["Riesgo de canibalización SEO con el cluster de taquillas melamina/colegios/escolares ya señalado en clusterNote y risks del contexto.","Se asume que la página sigue existiendo en esa URL y que el brief sigue vigente; si ha cambiado desde que se generó la work order, la propuesta debería revalidarse.","No hay datos de volumen de búsqueda real para la variante hiperlocal \"en palencia\", por lo que no se puede confirmar el impacto SEO esperado de esta mejora.","No se dispone de datos confirmados sobre cobertura de servicio, plazos de entrega o presencia local en Palencia; cualquier mención geográfica debe limitarse a la keyword/título, no a promesas de logística o presencia física.","El registro de decisiones humanas muestra que ya se cerraron actionItems de canibalización de \"taquillas melamina\", pero esta página es sobre fenólica: conviene confirmar con negocio si esa resolución también cubre el solapamiento con fenólica antes de publicar cambios de contenido más allá del title/meta."],"reasoningNotes":["Mantengo contentType como title_meta_improvement (coincide con contentTypeHint) en vez de expandir a un artículo completo, porque changeType es content_update de prioridad media sobre una keyword hiperlocal de la que no hay datos de volumen; la recommendedStructure se ofrece como mejoras ligeras de apoyo (para reforzar diferenciación y reducir canibalización), no como un artículo nuevo desde cero.","Sustituyo el heading genérico \"¿Que es taquillas fenólicas en palencia?\" del proposedStructureHint por encabezados orientados a beneficio/diferenciación, porque el original lee como plantilla de keyword-stuffing poco natural y no aporta valor real a la audiencia B2B.","El ángulo prioriza diferenciar fenólica frente a melamina/metálica precisamente porque el clusterNote y los risks del contexto señalan solapamiento con esas keywords; esto conecta directamente con la decisión humana ya aprobada de cerrar canibalización de 'taquillas melamina', aunque advierto en riesgos que esa resolución no cubre explícitamente el caso fenólica.","No incluyo ninguna sección de 'Precios y presupuesto' con cifras (a diferencia del proposedStructureHint que sugería un H2 'Precios y presupuesto'); en su lugar el bloque de CTA remite a solicitar presupuesto, siguiendo la regla de no fabricar precios ni plazos que no vienen en currentAssumptions."]}