{
  "contentOpportunity": {
    "title": "Landing mixta 'Industrial': mobiliario resistente + control de acceso para naves y fabricas",
    "summary": "La keyword 'industrial' capta interes B2B de sector industrial sin especificar si busca mueble o cerradura, por lo que conviene una landing puente que cualifique al visitante y lo derive a Zentry, Tukandado o ambos."
  },
  "targetAudience": "Responsable de compras, mantenimiento o PRL de una nave industrial, fabrica o almacen que necesita taquillas resistentes para el personal y/o un sistema de control de acceso para zonas restringidas o vestuarios.",
  "searchIntent": "commercial",
  "commercialIntent": "Captar trafico generico ligado al sector industrial y convertirlo en lead cualificado, derivando hacia solicitud de presupuesto de taquillas metalicas industriales (Zentry) o hacia informacion de cerraduras electronicas para ese mismo entorno (Tukandado), segun lo que el visitante indique al navegar la pagina.",
  "angle": "En vez de listar generalidades de 'taquillas industriales', la pieza actua como pagina puente/selector: usa el catalogo confirmado de materiales (metalica = maxima resistencia a impacto y uso intensivo) y de metodos de apertura (mecanica vs electronica) para ayudar al visitante a decidir en segundos si necesita mueble, cerradura o ambos, sin forzar la venta cruzada si su necesidad es solo una marca.",
  "contentType": "new_landing",
  "targetBrand": "mixed",
  "recommendedStructure": {
    "h1": "Mobiliario y control de acceso para entornos industriales",
    "sections": [
      {
        "heading": "¿Buscas mueble, cerradura o ambos?",
        "level": "H2",
        "purpose": "Cualificar de inmediato al visitante (llega por una keyword muy generica) y dirigirlo a la seccion Zentry, Tukandado o a la combinacion de ambas, evitando que abandone por no encontrar su caso rapido."
      },
      {
        "heading": "Solucion Zentry: taquillas para uso industrial",
        "level": "H2",
        "purpose": "Presentar el material metalico como opcion recomendada para entornos de uso intensivo (resistencia a impactos, acabado industrial), citando el catalogo confirmado de materiales, sin prometer precio ni plazo."
      },
      {
        "heading": "Solucion Tukandado: cerraduras para entornos industriales",
        "level": "H2",
        "purpose": "Explicar los metodos de apertura disponibles (mecanica sin mantenimiento electronico; electronica con PIN/tarjeta/app segun modelo) para que el visitante entienda que puede anadir control de acceso a taquillas nuevas o ya existentes."
      },
      {
        "heading": "Comparativa: apertura mecanica vs electronica",
        "level": "H3",
        "purpose": "Tabla comparativa (requisito de estructura de marca cuando se comparan opciones) que resuma sencillez/sin registro de uso (mecanica) frente a sin llave que perder/registro de accesos segun modelo (electronica), para apoyar la decision."
      },
      {
        "heading": "Como elegir segun tu caso",
        "level": "H2",
        "purpose": "Resumir 2-3 escenarios tipicos (solo mobiliario, solo control de acceso, ambos) y cerrar con la llamada a solicitar presupuesto/informacion segun el caso, sin inventar plazos ni condiciones."
      }
    ]
  },
  "ctaStrategy": {
    "primaryCta": "Ver taquillas industriales (Zentry)",
    "secondaryCta": "Ver cerraduras para entornos industriales (Tukandado)",
    "rationale": "El brandIntent es mixed_cross_sell y la keyword no revela si el interes es mueble o cerradura, asi que se mantiene el CTA doble ya sugerido en el contexto en vez de forzar un unico camino; cada CTA lleva a su propia via de conversion (presupuesto de mobiliario vs informacion/demo de control de acceso) sin contradecirse entre si."
  },
  "internalLinks": [
    {
      "anchorIdea": "Ver catalogo de taquillas industriales",
      "targetDescription": "Contenido/pagina de categoria Zentry sobre mobiliario (taquillas metalicas para uso industrial)",
      "isRealLink": false
    },
    {
      "anchorIdea": "Ver cerraduras electronicas Tukandado",
      "targetDescription": "Contenido/pagina de Tukandado sobre cerraduras electronicas (control de acceso)",
      "isRealLink": false
    }
  ],
  "supportingEvidence": [
    "brandRationale del contexto: 'No menciona explicitamente taquilla ni cerradura, pero tiene senales de contexto relevante (sector o material) que sugieren posible interes cruzado... Requiere revision manual para decidir Zentry vs Tukandado' -- justifica el enfoque de pagina puente/selector en vez de una landing mono-marca.",
    "clusterNote: 'No se detectaron otras keywords del backlog para formar cluster todavia' -- respalda tratar esta pieza como landing independiente por ahora, sin necesidad de desambiguar frente a otras paginas del cluster.",
    "currentAssumptions confirma que se asume que 'industrial' sigue siendo relevante y que el brief de origen sigue vigente -- no hay dato nuevo que contradiga la oportunidad, pero tampoco confirma volumen de busqueda real.",
    "secondaryKeywords viene vacio en el contexto, lo que refuerza que esta keyword aun no tiene variantes validadas -- limita la profundidad de contenido a lo que el catalogo de marca confirma (materiales, metodos de apertura), sin anadir subtemas no solicitados."
  ],
  "priority": "medium",
  "risksAndUnknowns": [
    "Riesgo ya identificado en el contexto: publicar contenido nuevo sin revisar el cluster SEO puede generar canibalizacion con paginas ya existentes.",
    "La keyword 'industrial' es una unica palabra muy generica (sin modificador tipo 'taquillas industriales' o 'cerradura industrial'); existe riesgo real de que el volumen de busqueda real no tenga intencion relacionada con mobiliario/control de acceso, o que la intencion predominante sea informativa/ajena al sector de Zentry/Tukandado.",
    "brandRationale marca explicitamente que 'requiere revision manual para decidir Zentry vs Tukandado' -- la clasificacion mixed_cross_sell de este brief es un punto de partida, no una decision cerrada; conviene validacion humana antes de ejecutar.",
    "currentAssumptions no confirma 'fabricante directo', garantia ni plazos de entrega para esta pagina -- el brief evita deliberadamente esas afirmaciones y remite a 'solicitar presupuesto'/'informacion' en el CTA; cualquier redactor posterior debe respetar esa misma restriccion.",
    "Existe un precedente humano reciente (rechazo de publicacion de paginas de staging similares) por considerarlas 'demasiado basicas y sin suficientes imagenes/fotografias'; aunque este brief es para una pagina nueva distinta, conviene que la ejecucion final cuide la riqueza visual/de contenido antes de plantear su paso a produccion."
  ],
  "reasoningNotes": [
    "Clasifique searchIntent como 'commercial' siguiendo la senal B2B que ya marca brandRationale, pero lo dejo explicitamente cuestionado en risksAndUnknowns porque una keyword de una sola palabra ('industrial') es demasiado ambigua para confirmar intencion sin mas datos.",
    "Amplie proposedStructureHint anadiendo una tabla comparativa (H3) mecanica vs electronica porque la skill de marca exige 'al menos una tabla comparativa cuando el contenido compara opciones', y esta landing compara explicitamente mobiliario vs cerradura y mecanica vs electronica.",
    "Mantuve el CTA doble de recommendedCtaHint en vez de forzar un unico CTA, porque brandIntent es mixed_cross_sell y no hay datos que indiquen que una de las dos marcas domine la demanda real de esta keyword.",
    "No afirme 'fabricante directo' ni garantias porque currentAssumptions no las confirma para esta pagina; use exclusivamente hechos de catalogo ya confirmados en la skill (materiales, metodos de apertura) como base del angulo."
  ]
}