{"contentOpportunity":{"title":"Actualizar title/meta y refrescar el contenido de la pagina existente taquillas-melamina","summary":"La pagina ya posicionada para 'taquillas melamina' necesita un title/meta mas especifico y contenido que la diferencie claramente de las paginas vecinas del cluster (colegios, escolares, fenolica en Palencia, comprar taquillas) para mejorar CTR y evitar canibalizacion."},"targetAudience":"Responsable de compras o mantenimiento de un colegio, oficina o instalacion que necesita equipar/renovar taquillas en un entorno seco y esta comparando materiales antes de pedir presupuesto.","searchIntent":"commercial","commercialIntent":"Captar trafico en fase de comparacion de materiales (melamina vs otras opciones) y convertirlo en solicitudes de presupuesto para taquillas de melamina, especialmente de perfiles de colegios/oficinas que buscan la opcion mas economica en entornos secos.","angle":"Posicionar esta pagina como la referencia clara sobre el material melamina (acabado, uso recomendado, cuando NO es la mejor opcion frente a fenolica/metalica), enlazando de forma explicita hacia las paginas hermanas del cluster (colegios, escolares, fenolica) en vez de competir con ellas por las mismas keywords, y evitando cualquier bloque de precios/plazos concretos que no esten confirmados.","contentType":"title_meta_improvement","targetBrand":"zentry","recommendedStructure":{"h1":"Taquillas de Melamina","sections":[{"heading":"Que son las taquillas de melamina","level":"H2","purpose":"Definir el material y su acabado, y situar de inmediato en que entornos encaja (oficinas, colegios, vestuarios secos) para que el lector confirme que es la pagina que buscaba."},{"heading":"Ventajas del acabado en melamina","level":"H2","purpose":"Explicar acabado calido tipo madera, buena relacion calidad-precio y resistencia media a la humedad, usando solo el catalogo de materiales confirmado."},{"heading":"Melamina vs fenolica vs metalica: como elegir el material","level":"H2","purpose":"Tabla comparativa de los tres materiales confirmados con sus usos tipicos, ayudando a decidir y enlazando de forma natural hacia las paginas del cluster sobre fenolica/metalica."},{"heading":"Diferencias entre uso en colegios y otros entornos","level":"H3","purpose":"Conectar con la intencion de busqueda de las keywords relacionadas de colegios/escolares sin duplicar esas paginas, remitiendo a ellas para mas detalle."},{"heading":"Como elegir la medida y configuracion de taquilla","level":"H2","purpose":"Guia general de criterios de eleccion (numero de compartimentos, tamano de usuario/objeto) sin inventar dimensiones o modelos concretos no presentes en el contexto."},{"heading":"Solicita tu presupuesto de taquillas de melamina","level":"H2","purpose":"Bloque de conversion que remite a presupuesto a medida sin afirmar precios ni plazos concretos, ya que no hay cifras confirmadas en el contexto."},{"heading":"Preguntas frecuentes sobre taquillas de melamina","level":"H2","purpose":"Resolver dudas habituales de compra (mantenimiento, durabilidad, comparacion con otros materiales) usando solo hechos del catalogo confirmado, sin afirmar garantia ni fabricante directo."}]},"ctaStrategy":{"primaryCta":"Solicitar presupuesto sin compromiso","secondaryCta":"Ver taquillas para colegios y vestuarios","rationale":"El intent es comercial/comparativo (el usuario evalua el material antes de comprar), por lo que un CTA de presupuesto encaja mejor que uno de contenido puramente informativo; se mantiene el CTA sugerido por el pipeline (recommendedCtaHint) por ser coherente con el brandIntent zentry_locker_core. El CTA secundario dirige trafico dentro del cluster (colegios/escolares) sin repetir el mensaje principal."},"internalLinks":[{"anchorIdea":"Compara materiales: taquillas fenolicas y metalicas","targetDescription":"pagina/categoria de taquillas fenolicas, keyword relacionada: taquillas fenólicas en palencia","isRealLink":false},{"anchorIdea":"Taquillas para colegios","targetDescription":"pagina de categoria taquillas escolares/colegios, keywords relacionadas: taquillas colegios, taquillas escolares","isRealLink":false},{"anchorIdea":"Ver catalogo completo y pedir presupuesto","targetDescription":"pagina/landing general de compra de taquillas, keyword relacionada: comprar taquillas","isRealLink":false}],"supportingEvidence":["clusterNote del contexto: posible cluster SEO con taquillas de melamina, taquillas colegios, taquillas escolares, taquillas fenólicas en palencia y comprar taquillas, con recomendacion explicita de enlazado interno entre esas paginas.","currentAssumptions confirma que se asume que la pagina https://zentrylockers.com/taquillas-melamina/ sigue existiendo en esa URL, por lo que se trata de una actualizacion de pagina existente, no de contenido nuevo.","Decision humana previa ya aprobada: 'Cerrar los actionItems de canibalizacion de taquillas melamina y revisar la aprobacion critica pendiente relacionada', lo que respalda tratar el riesgo de canibalizacion como algo ya gestionado a nivel de portfolio, aunque conviene verificar que la accion se ejecuto antes de publicar.","secondaryKeywords del contexto (taquillas de melamina, taquillas colegios, taquillas escolares, comprar taquillas) respaldan el angulo de audiencia colegios/oficinas y la intencion comercial."],"priority":"medium","risksAndUnknowns":["Riesgo de canibalizacion SEO con paginas del mismo cluster (colegios, escolares, fenolica en Palencia, comprar taquillas) si no se coordina el enlazado interno y la diferenciacion tematica.","El changePack aprobado sobre cierre de canibalizacion de 'taquillas melamina' deberia verificarse como ya ejecutado antes de publicar este cambio, para no reabrir el mismo conflicto.","No hay en el contexto ninguna cifra de precio, plazo de entrega ni condicion de garantia: cualquier bloque de 'Precios y presupuesto' debe remitir a solicitar presupuesto, sin inventar numeros.","No se dispone del title/meta actual de la pagina para comparar contra el propuesto, lo que limita evaluar cuanto cambia realmente el CTR.","currentAssumptions marca que se asume vigencia de la keyword y del brief: si la relevancia de 'taquillas melamina' ha cambiado desde que se genero la work order, este brief podria quedar desactualizado."],"reasoningNotes":["Se mantiene contentType como title_meta_improvement (coincide con contentTypeHint) aunque proposedStructureHint describe una estructura de articulo completo; se interpreta que, al ser changeType 'content_update' (no solo meta), el ambito incluye tambien un refresco de contenido on-page que soporte el nuevo title/meta, sin que esto implique reescribir la pagina entera desde cero.","Se sustituyo la seccion 'Precios y presupuesto' del hint por 'Solicita tu presupuesto de taquillas de melamina' para evitar cualquier lectura de que se van a mostrar precios concretos, ya que no hay cifras en currentAssumptions ni en el resto del contexto (regla anti-fabricacion).","searchIntent se marca como 'commercial' y no 'informational' porque las secondaryKeywords incluyen 'comprar taquillas', senal de intencion de compra cercana, no solo busqueda de definicion.","priority se mantiene en 'medium' heredada del contexto: no hay senal en el input (trafico, impresiones, CTR) que justifique subirla o bajarla respecto a lo ya decidido por el pipeline determinista."]}