{"contentOpportunity":{"title":"Landing sectorial \"hotel\": taquillas y cerraduras para el sector hotelero","summary":"La keyword \"hotel\" no tiene aun pagina dedicada y combina interes potencial en mobiliario (Zentry) y control de acceso (Tukandado), lo que justifica una landing nueva que cualifique al visitante antes de derivarlo a una u otra solucion."},"targetAudience":"responsable de compras, mantenimiento o direccion de operaciones de un hotel que necesita equipar zonas de personal (vestuarios, recepcion, spa/piscina) con taquillas y/o un sistema de apertura para ese mobiliario","searchIntent":"commercial","commercialIntent":"Captar leads B2B del sector hotelero que buscan proveedor de taquillas para personal o control de acceso electronico, derivandolos al formulario de presupuesto de la marca que corresponda a su necesidad real","angle":"En vez de asumir que quien busca \"hotel\" necesita mueble o cerradura, la landing cualifica primero el caso de uso (recepcion, vestuario de personal, zona de piscina/spa) y solo entonces recomienda material o metodo de apertura, apoyandose en el catalogo confirmado (p.ej. fenolica para zonas humedas tipicas de hoteles con piscina/spa)","contentType":"new_landing","targetBrand":"mixed","recommendedStructure":{"h1":"Taquillas y cerraduras para hoteles","sections":[{"heading":"¿Buscas mueble, cerradura o ambos?","level":"H2","purpose":"Cualificar al visitante desde el inicio (mobiliario nuevo, cerradura para taquillas existentes, o ambos) para dirigirlo a la seccion relevante sin forzar venta cruzada si no aplica"},{"heading":"Taquillas para personal y zonas del hotel (Zentry)","level":"H2","purpose":"Presentar los materiales del catalogo confirmado (melamina, fenolica, metalica) relacionandolos con zonas tipicas de un hotel -- p.ej. fenolica para spa/piscina por su resistencia a la humedad, melamina para vestuarios secos de personal"},{"heading":"Cerraduras electronicas para las taquillas del hotel (Tukandado)","level":"H2","purpose":"Explicar los metodos de apertura disponibles (mecanica, PIN, tarjeta/RFID, app segun modelo) para taquillas de personal, sin prometer una funcionalidad como universal"},{"heading":"Como elegir segun tu caso","level":"H2","purpose":"Dar un criterio practico de decision por escenario (recepcion, vestuario de personal, zona humeda) para que el lector se autoseleccione antes de pedir presupuesto"}]},"ctaStrategy":{"primaryCta":"Solicitar presupuesto de taquillas","secondaryCta":"Solicitar informacion sobre cerraduras electronicas","rationale":"El recommendedCtaHint ya proponia un CTA doble (\"Ver taquillas\" + \"Ver cerraduras\"); lo adapto a acciones de conversion B2B (presupuesto/informacion) en vez de \"ver\", coherente con que ambas marcas venden a medida y no tienen checkout online, evitando prometer una accion que el sitio no puede ejecutar"},"internalLinks":[{"anchorIdea":"Ver catalogo de taquillas Zentry","targetDescription":"contenido/landing de mobiliario Zentry relacionado con el sector hotelero (segun internalLinkHints, sin URL real disponible en el contexto)","isRealLink":false},{"anchorIdea":"Ver cerraduras electronicas Tukandado","targetDescription":"contenido/landing de cerraduras Tukandado relacionado con control de acceso para taquillas de personal (segun internalLinkHints, sin URL real disponible en el contexto)","isRealLink":false},{"anchorIdea":"Soluciones para hoteles (plural)","targetDescription":"posible pagina o keyword \"hoteles\" senalada en clusterNote como cluster SEO relacionado con esta keyword \"hotel\" -- enlazar solo si esa pagina existe y se resuelve la posible duplicidad, sin URL real disponible en el contexto","isRealLink":false}],"supportingEvidence":["currentAssumptions confirma que se asume que \"hotel\" sigue siendo relevante para Zentry y Tukandado y que el brief sigue vigente, pero ambos son supuestos, no hechos verificados","clusterNote y secondaryKeywords (\"hoteles\") indican una keyword casi identica en singular/plural, lo que respalda tratar esta pieza como parte de un cluster a coordinar y no como pagina aislada","brandRationale del contexto marca explicitamente que la keyword requiere revision manual para decidir Zentry vs Tukandado, lo que respalda el angulo de landing cualificadora en vez de una pagina mono-marca"],"priority":"medium","risksAndUnknowns":["Riesgo de canibalizacion SEO entre \"hotel\" (esta pagina) y \"hoteles\" (senalado en clusterNote como cluster relacionado) -- recomendable resolverlo antes de publicar, en linea con la decision previa ya aprobada de cerrar los actionItems de canibalizacion de keywords similares","Publicar contenido nuevo sin revisar el cluster SEO existente puede generar canibalizacion con paginas ya existentes (riesgo ya identificado en el contexto)","La intencion de busqueda real de \"hotel\" no esta confirmada al 100% (brandRationale la marca como mixta y de revision manual), por lo que el reparto de contenido entre Zentry y Tukandado podria necesitar ajuste tras validacion humana","No hay URL de pagina (\"page\") en el contexto, por lo que ningun enlace interno propuesto puede marcarse como real todavia","Una decision humana previa rechazo publicar en produccion otras landings nuevas de staging por verse \"demasiado basicas y sin suficientes imagenes/fotografias\" -- conviene tener en cuenta ese estandar visual/de contenido antes de dar esta landing por lista para produccion"],"reasoningNotes":["Elegi contentType \"new_landing\" siguiendo literalmente el contentTypeHint (\"Landing nueva\"), sin apartarme de el, dado que ademas encaja con el brandIntent mixed_cross_sell","Fije searchIntent como \"commercial\" en vez de dejarlo ambiguo: aunque brandRationale describe la intencion como mixta, una keyword sectorial B2B corta como \"hotel\" suele reflejar busqueda de proveedor mas que investigacion informativa pura; el matiz mixto queda resuelto en la estructura (seccion de autoseleccion) en vez de en el campo de intent","Amplie el proposedStructureHint añadiendo relacion explicita entre materiales del catalogo confirmado (fenolica para zonas humedas) y escenarios reales de un hotel (spa/piscina), para que el brief aporte valor diferenciador y no solo repita los H2 genericos recibidos","Priorice como riesgo principal la cercania entre \"hotel\" y \"hoteles\" del clusterNote porque el departamento ya aprobo previamente una accion equivalente (cerrar canibalizacion de otra keyword), lo que sugiere que este tipo de duplicidad es una prioridad conocida antes de invertir esfuerzo de publicacion","No afirme \"fabricante directo\", garantias ni funcionalidades universales de las cerraduras porque currentAssumptions no las confirma para esta pagina; los CTA remiten a presupuesto/informacion en vez de prometer datos no verificados"]}